{
  "contractVersion": 2,
  "variantId": "rpi5",
  "graphHash": "97de264d98dcd9d525b26cac7f211279f446a59352bc822a1d3a68ca267d2665",
  "results": [
    {
      "kind": "assemblyStep",
      "id": "PX-V40-STEP-01",
      "label": "Prepare Plate A mounting supports",
      "printedNumber": 1,
      "sourceRefs": [
        "PX-EV-PHOTO-04"
      ],
      "destination": {
        "kind": "assemblyStep",
        "variantId": "rpi5",
        "stepId": "PX-V40-STEP-01"
      }
    },
    {
      "kind": "assemblyStep",
      "id": "PX-V40-STEP-02",
      "label": "Mount the selected Raspberry Pi",
      "printedNumber": 2,
      "sourceRefs": [
        "PX-EV-PHOTO-04"
      ],
      "destination": {
        "kind": "assemblyStep",
        "variantId": "rpi5",
        "stepId": "PX-V40-STEP-02"
      }
    },
    {
      "kind": "assemblyStep",
      "id": "PX-V40-STEP-03",
      "label": "Connect the Pi end of the camera ribbon",
      "printedNumber": 3,
      "sourceRefs": [
        "PX-EV-PHOTO-04"
      ],
      "destination": {
        "kind": "assemblyStep",
        "variantId": "rpi5",
        "stepId": "PX-V40-STEP-03"
      }
    },
    {
      "kind": "assemblyStep",
      "id": "PX-V40-STEP-04",
      "label": "Mount the Robot HAT",
      "printedNumber": 4,
      "sourceRefs": [
        "PX-EV-PHOTO-04"
      ],
      "destination": {
        "kind": "assemblyStep",
        "variantId": "rpi5",
        "stepId": "PX-V40-STEP-04"
      }
    },
    {
      "kind": "assemblyStep",
      "id": "PX-V40-STEP-05",
      "label": "Install the two drive motors",
      "printedNumber": 5,
      "sourceRefs": [
        "PX-EV-PHOTO-04"
      ],
      "destination": {
        "kind": "assemblyStep",
        "variantId": "rpi5",
        "stepId": "PX-V40-STEP-05"
      }
    },
    {
      "kind": "assemblyStep",
      "id": "PX-V40-STEP-06",
      "label": "Prepare battery hook-and-loop mounting",
      "printedNumber": 6,
      "sourceRefs": [
        "PX-EV-PHOTO-05"
      ],
      "destination": {
        "kind": "assemblyStep",
        "variantId": "rpi5",
        "stepId": "PX-V40-STEP-06"
      }
    },
    {
      "kind": "assemblyStep",
      "id": "PX-V40-STEP-07",
      "label": "Secure and connect the battery",
      "printedNumber": 7,
      "sourceRefs": [
        "PX-EV-PHOTO-05"
      ],
      "destination": {
        "kind": "assemblyStep",
        "variantId": "rpi5",
        "stepId": "PX-V40-STEP-07"
      }
    },
    {
      "kind": "assemblyStep",
      "id": "PX-V40-STEP-08",
      "label": "Attach the pan horn to the front chassis",
      "printedNumber": 8,
      "sourceRefs": [
        "PX-EV-PHOTO-05"
      ],
      "destination": {
        "kind": "assemblyStep",
        "variantId": "rpi5",
        "stepId": "PX-V40-STEP-08"
      }
    },
    {
      "kind": "assemblyStep",
      "id": "PX-V40-STEP-09",
      "label": "Install the ultrasonic module and Plate H",
      "printedNumber": 9,
      "sourceRefs": [
        "PX-EV-PHOTO-05"
      ],
      "destination": {
        "kind": "assemblyStep",
        "variantId": "rpi5",
        "stepId": "PX-V40-STEP-09"
      }
    },
    {
      "kind": "assemblyStep",
      "id": "PX-V40-STEP-10",
      "label": "Fit the two front support standoffs",
      "printedNumber": 10,
      "sourceRefs": [
        "PX-EV-PHOTO-05"
      ],
      "destination": {
        "kind": "assemblyStep",
        "variantId": "rpi5",
        "stepId": "PX-V40-STEP-10"
      }
    },
    {
      "kind": "assemblyStep",
      "id": "PX-V40-STEP-11",
      "label": "Connect the camera end of the ribbon",
      "printedNumber": 11,
      "sourceRefs": [
        "PX-EV-PHOTO-05"
      ],
      "destination": {
        "kind": "assemblyStep",
        "variantId": "rpi5",
        "stepId": "PX-V40-STEP-11"
      }
    },
    {
      "kind": "assemblyStep",
      "id": "PX-V40-STEP-12",
      "label": "Mount the camera on Plate C",
      "printedNumber": 12,
      "sourceRefs": [
        "PX-EV-PHOTO-05"
      ],
      "destination": {
        "kind": "assemblyStep",
        "variantId": "rpi5",
        "stepId": "PX-V40-STEP-12"
      }
    },
    {
      "kind": "assemblyStep",
      "id": "PX-V40-STEP-13",
      "label": "Attach the tilt horn to Plate C",
      "printedNumber": 13,
      "sourceRefs": [
        "PX-EV-PHOTO-05"
      ],
      "destination": {
        "kind": "assemblyStep",
        "variantId": "rpi5",
        "stepId": "PX-V40-STEP-13"
      }
    },
    {
      "kind": "assemblyStep",
      "id": "PX-V40-STEP-14",
      "label": "Install the pan servo on Plate B",
      "printedNumber": 14,
      "sourceRefs": [
        "PX-EV-PHOTO-05"
      ],
      "destination": {
        "kind": "assemblyStep",
        "variantId": "rpi5",
        "stepId": "PX-V40-STEP-14"
      }
    },
    {
      "kind": "assemblyStep",
      "id": "PX-V40-STEP-15",
      "label": "Install the tilt servo on Plate B",
      "printedNumber": 15,
      "sourceRefs": [
        "PX-EV-PHOTO-05"
      ],
      "destination": {
        "kind": "assemblyStep",
        "variantId": "rpi5",
        "stepId": "PX-V40-STEP-15"
      }
    },
    {
      "kind": "assemblyStep",
      "id": "PX-V40-STEP-16",
      "label": "Route the camera ribbon through the gimbal gap",
      "printedNumber": 16,
      "sourceRefs": [
        "PX-EV-PHOTO-05"
      ],
      "destination": {
        "kind": "assemblyStep",
        "variantId": "rpi5",
        "stepId": "PX-V40-STEP-16"
      }
    },
    {
      "kind": "assemblyStep",
      "id": "PX-V40-STEP-17",
      "label": "Introduce the servo-zeroing procedure",
      "printedNumber": 17,
      "sourceRefs": [
        "PX-EV-PHOTO-05"
      ],
      "destination": {
        "kind": "assemblyStep",
        "variantId": "rpi5",
        "stepId": "PX-V40-STEP-17"
      }
    },
    {
      "kind": "assemblyStep",
      "id": "PX-V40-STEP-18",
      "label": "Mate the camera/Plate-C assembly to tilt",
      "printedNumber": 18,
      "sourceRefs": [
        "PX-EV-PHOTO-06"
      ],
      "destination": {
        "kind": "assemblyStep",
        "variantId": "rpi5",
        "stepId": "PX-V40-STEP-18"
      }
    },
    {
      "kind": "assemblyStep",
      "id": "PX-V40-STEP-19",
      "label": "Mate the pan-tilt assembly to the chassis",
      "printedNumber": 19,
      "sourceRefs": [
        "PX-EV-PHOTO-06"
      ],
      "destination": {
        "kind": "assemblyStep",
        "variantId": "rpi5",
        "stepId": "PX-V40-STEP-19"
      }
    },
    {
      "kind": "assemblyStep",
      "id": "PX-V40-STEP-20",
      "label": "Install the steering servo",
      "printedNumber": 20,
      "sourceRefs": [
        "PX-EV-PHOTO-06"
      ],
      "destination": {
        "kind": "assemblyStep",
        "variantId": "rpi5",
        "stepId": "PX-V40-STEP-20"
      }
    },
    {
      "kind": "assemblyStep",
      "id": "PX-V40-STEP-21",
      "label": "Connect Plate G to the steering horn",
      "printedNumber": 21,
      "sourceRefs": [
        "PX-EV-PHOTO-06"
      ],
      "destination": {
        "kind": "assemblyStep",
        "variantId": "rpi5",
        "stepId": "PX-V40-STEP-21"
      }
    },
    {
      "kind": "assemblyStep",
      "id": "PX-V40-STEP-22",
      "label": "Attach the steering horn assembly to its servo",
      "printedNumber": 22,
      "sourceRefs": [
        "PX-EV-PHOTO-06"
      ],
      "destination": {
        "kind": "assemblyStep",
        "variantId": "rpi5",
        "stepId": "PX-V40-STEP-22"
      }
    },
    {
      "kind": "assemblyStep",
      "id": "PX-V40-STEP-23",
      "label": "Install Plate D on the front supports",
      "printedNumber": 23,
      "sourceRefs": [
        "PX-EV-PHOTO-06"
      ],
      "destination": {
        "kind": "assemblyStep",
        "variantId": "rpi5",
        "stepId": "PX-V40-STEP-23"
      }
    },
    {
      "kind": "assemblyStep",
      "id": "PX-V40-STEP-24",
      "label": "Attach the grayscale module to Plate D",
      "printedNumber": 24,
      "sourceRefs": [
        "PX-EV-PHOTO-06"
      ],
      "destination": {
        "kind": "assemblyStep",
        "variantId": "rpi5",
        "stepId": "PX-V40-STEP-24"
      }
    },
    {
      "kind": "assemblyStep",
      "id": "PX-V40-STEP-25",
      "label": "Install right and left front wheel carriers",
      "printedNumber": 25,
      "sourceRefs": [
        "PX-EV-PHOTO-06"
      ],
      "destination": {
        "kind": "assemblyStep",
        "variantId": "rpi5",
        "stepId": "PX-V40-STEP-25"
      }
    },
    {
      "kind": "assemblyStep",
      "id": "PX-V40-STEP-26",
      "label": "Install the front wheels",
      "printedNumber": 26,
      "sourceRefs": [
        "PX-EV-PHOTO-06"
      ],
      "destination": {
        "kind": "assemblyStep",
        "variantId": "rpi5",
        "stepId": "PX-V40-STEP-26"
      }
    },
    {
      "kind": "assemblyStep",
      "id": "PX-V40-STEP-27",
      "label": "Fit the rear wheels to motor shafts",
      "printedNumber": 27,
      "sourceRefs": [
        "PX-EV-PHOTO-06"
      ],
      "destination": {
        "kind": "assemblyStep",
        "variantId": "rpi5",
        "stepId": "PX-V40-STEP-27"
      }
    },
    {
      "kind": "assemblyStep",
      "id": "PX-V40-STEP-28",
      "label": "Connect the sensor ends of their cables",
      "printedNumber": 28,
      "sourceRefs": [
        "PX-EV-PHOTO-06"
      ],
      "destination": {
        "kind": "assemblyStep",
        "variantId": "rpi5",
        "stepId": "PX-V40-STEP-28"
      }
    },
    {
      "kind": "assemblyStep",
      "id": "PX-V40-STEP-29",
      "label": "Complete the Robot HAT wiring",
      "printedNumber": 29,
      "sourceRefs": [
        "PX-EV-PHOTO-06"
      ],
      "destination": {
        "kind": "assemblyStep",
        "variantId": "rpi5",
        "stepId": "PX-V40-STEP-29"
      }
    },
    {
      "kind": "assemblyPart",
      "id": "PX-V40-INS-BATTERY-001",